{
  "schemaVersion": 1,
  "id": "trains-demo",
  "title": "Экономика подвижного состава",
  "subtitle": "Две альтернативы на горизонте двадцати лет",
  "kind": "Прикладная программа",
  "year": 2008,
  "status": "demo",
  "summary": "Демонстрация расчёта приведённых затрат: приобретение, обслуживание и энергия. Все цены, параметры альтернатив и год условны.",
  "tags": [
    "ТЭО",
    "Сценарии",
    "Delphi / Pascal"
  ],
  "cover": "content/assets/trains-demo/alternatives.svg",
  "sections": [
    {
      "id": "question",
      "title": "Что сравниваем",
      "paragraphs": [
        "Более низкая цена приобретения ещё не определяет общие затраты за срок службы. Разница в обслуживании и расходе энергии может изменить порядок альтернатив при увеличении горизонта расчёта.",
        "Здесь рассматриваются два вымышленных варианта подвижного состава A и B. Предполагается, что они выполняют одинаковый объём полезной работы. Этот пример показывает устройство будущей главы о программе ТЭО, а не результаты реального проекта."
      ]
    },
    {
      "id": "inputs",
      "title": "Исходные параметры",
      "paragraphs": [
        "Вариант A стоит 120 млн руб., обслуживание — 4,2 млн руб./год, энергопотребление — 4,7 кВт·ч/км. У варианта B значения равны 145 млн руб., 3,4 млн руб./год и 3,8 кВт·ч/км.",
        "По умолчанию пробег составляет 250 000 км/год, тариф — 8 руб./кВт·ч, горизонт — 20 лет, ставка дисконтирования — 5% годовых. Параметры синтетические: они не отражают рыночные предложения или отраслевые нормативы."
      ]
    },
    {
      "id": "model",
      "title": "Как расходы приводятся к одному моменту",
      "paragraphs": [
        "Приобретение учитывается в момент начала расчёта. Обслуживание и энергия оплачиваются в конце каждого года. Каждая годовая сумма делится на соответствующую степень 1 + r.",
        "При исходных параметрах ежегодные расходы A равны 13,6 млн руб., B — 11,0 млн руб. Все значения денежных показателей на графике приведены к начальному моменту и выражены в миллионах рублей."
      ],
      "formula": "C(T) = C₀ + Σₜ₌₁ᵀ (M + L·e·q / 10⁶) / (1+r)ᵗ; C₀ и M — в млн руб."
    },
    {
      "id": "result",
      "title": "Что меняется при длинном горизонте",
      "paragraphs": [
        "К двадцатому году приведённые затраты составляют около 289,49 млн руб. для A и 282,08 млн руб. для B. Разность около 7,40 млн руб. относится только к принятым параметрам этой модели.",
        "Интерактивный пример позволяет изменить пробег, тариф, ставку и горизонт. Статический график и CSV сохраняют исходный сценарий, чтобы результат можно было прочитать и проверить отдельно. Это сравнение затрат, а не расчёт доходности инвестиций."
      ]
    },
    {
      "id": "limits",
      "title": "Границы модели",
      "paragraphs": [
        "Расчёт не учитывает выручку, инфляцию, налоги, финансирование, остаточную стоимость, простои, инфраструктуру и детальный график ремонтов. Одинаковая полезная работа двух альтернатив принята как предположение.",
        "При разборе настоящих программ ТЭО потребуется установить состав затрат, базу цен, единицы измерения и назначение каждого коэффициента. Их нельзя автоматически заменить числами или формулами из этого примера."
      ]
    }
  ],
  "figures": [
    {
      "id": "alternatives",
      "title": "Две учебные альтернативы",
      "path": "content/assets/trains-demo/alternatives.svg",
      "caption": "Условные параметры A и B. Схема создана для демонстрации, реальные модели поездов не используются.",
      "alt": "Покупка, обслуживание и энергопотребление двух синтетических вариантов A и B.",
      "provenance": "demo"
    },
    {
      "id": "cashflow",
      "title": "Временная схема затрат",
      "path": "content/assets/trains-demo/cashflow.svg",
      "caption": "Покупка в момент 0, расходы эксплуатации — в конце каждого года. Учебная модель при ставке 5%.",
      "alt": "Начальное приобретение и дисконтирование ежегодных расходов с первого по двадцатый год.",
      "provenance": "demo"
    }
  ],
  "charts": [
    {
      "id": "cost-horizon",
      "title": "Приведённые затраты по годам",
      "xLabel": "Горизонт, лет",
      "yLabel": "Приведённые затраты, млн руб.",
      "series": [
        {
          "id": "alternative-a",
          "name": "Вариант A",
          "values": [
            [
              0.0,
              120.0
            ],
            [
              1.0,
              132.952380952
            ],
            [
              2.0,
              145.287981859
            ],
            [
              3.0,
              157.036173199
            ],
            [
              4.0,
              168.224926857
            ],
            [
              5.0,
              178.880882721
            ],
            [
              6.0,
              189.029412115
            ],
            [
              7.0,
              198.694678205
            ],
            [
              8.0,
              207.899693528
            ],
            [
              9.0,
              216.666374789
            ],
            [
              10.0,
              225.015595037
            ],
            [
              11.0,
              232.967233368
            ],
            [
              12.0,
              240.540222256
            ],
            [
              13.0,
              247.752592624
            ],
            [
              14.0,
              254.621516785
            ],
            [
              15.0,
              261.163349319
            ],
            [
              16.0,
              267.393666018
            ],
            [
              17.0,
              273.32730097
            ],
            [
              18.0,
              278.978381876
            ],
            [
              19.0,
              284.360363691
            ],
            [
              20.0,
              289.486060659
            ]
          ]
        },
        {
          "id": "alternative-b",
          "name": "Вариант B",
          "values": [
            [
              0.0,
              145.0
            ],
            [
              1.0,
              155.476190476
            ],
            [
              2.0,
              165.453514739
            ],
            [
              3.0,
              174.955728323
            ],
            [
              4.0,
              184.005455546
            ],
            [
              5.0,
              192.624243377
            ],
            [
              6.0,
              200.83261274
            ],
            [
              7.0,
              208.650107371
            ],
            [
              8.0,
              216.095340354
            ],
            [
              9.0,
              223.186038432
            ],
            [
              10.0,
              229.939084221
            ],
            [
              11.0,
              236.370556401
            ],
            [
              12.0,
              242.495768001
            ],
            [
              13.0,
              248.329302858
            ],
            [
              14.0,
              253.885050341
            ],
            [
              15.0,
              259.17623842
            ],
            [
              16.0,
              264.215465162
            ],
            [
              17.0,
              269.014728726
            ],
            [
              18.0,
              273.585455929
            ],
            [
              19.0,
              277.938529456
            ],
            [
              20.0,
              282.084313768
            ]
          ]
        }
      ],
      "note": "Синтетический базовый сценарий: 250 000 км/год, 8 руб./кВт·ч, ставка 5%. Платежи конца года, без остаточной стоимости. Сравнение затрат, не доходности.",
      "provenance": "demo"
    }
  ],
  "code": [
    {
      "id": "pascal-cost",
      "title": "Приведённые затраты · Pascal",
      "language": "pascal",
      "path": "content/assets/trains-demo/cost-demo.pas",
      "note": "Новая учебная программа, синтаксис Free Pascal. Не исходник старого проекта Delphi. Стоимость задаётся в млн руб.",
      "highlights": [
        {
          "start": 14,
          "end": 17,
          "label": "Ежегодные расходы"
        },
        {
          "start": 19,
          "end": 34,
          "label": "Приведение расходов по годам"
        }
      ]
    }
  ],
  "sources": [
    {
      "id": "notes",
      "title": "Допущения и параметры · TXT",
      "path": "content/assets/trains-demo/source-notes.txt",
      "type": "text/plain",
      "note": "Полное описание синтетического сценария и его ограничений.",
      "provenance": "demo"
    },
    {
      "id": "csv",
      "title": "Базовый сценарий · CSV",
      "path": "content/assets/trains-demo/cost-series.csv",
      "type": "text/csv",
      "note": "Приведённые затраты A и B на горизонте от 0 до 20 лет. Значения в млн руб.",
      "provenance": "demo"
    },
    {
      "id": "source",
      "title": "Учебный расчёт · Pascal",
      "path": "content/assets/trains-demo/cost-demo.pas",
      "type": "text/plain",
      "note": "Исходник новой демонстрационной модели.",
      "provenance": "demo"
    }
  ],
  "experiment": {
    "type": "trains",
    "note": "Все значения синтетические. Меняйте горизонт, пробег, тариф и ставку; сравниваются приведённые затраты при одинаковой полезной работе. Остаточная стоимость, выручка и инфляция не включены."
  },
  "methodNotes": [
    "Год 2008 и все данные этой главы условны. Реальная программа ТЭО не исследована.",
    "Приобретение учитывается в год 0; ежегодные расходы — в конце года.",
    "Сравниваются приведённые затраты, а не NPV проекта с выручкой и не окупаемость инвестиции.",
    "Модель предполагает равную полезную работу вариантов и постоянные параметры.",
    "Исторические цены, единицы и формулы будут определяться по материалам реального архива."
  ]
}
